{
    "modelName": "myModel",
    "description": "Test case",
    "variables": [
        {
            "name": "dummy",
            "variability": "continuous",
            "causality": "input",
            "initial": "approx",
            "typeID": "Real",
            "startValue": 271.5,
            "valueRef": 42,
            "description": "",
            "unit": "K"
        },
        {
            "name": "other",
            "variability": "discrete",
            "causality": "output",
            "initial": "exact",
            "typeID": "Integer",
            "startValue": 271,
            "valueRef": 42,
            "description": "",
            "unit": "M"
        }
    ],
	"pythonSource": "InconsistentFunctions/testCode.py",
    "pythonFunctions": {
        "initCS": [
            {
                "pythonName": "init",
                "arguments": [],
                "output": "tempOut"
            }
        ],
        "stepCS": [
            {
                "pythonName": "do_step",
                "arguments": ["startTime", "stop_time"],
                "output": "tempOut"
            }
        ]
    }
}