{
    "modelName": "myModel",
    "variables": [
    ],
	"pythonSource": "InconsistentFunctions/testCode.py",
    "pythonFunctions": {
        "initCS": [
            {
                "pythonName": "init",
                "arguments": [],
                "output": "tempOut"
            }
        ],
        "stepCS": [
            {
                "pythonName": "do_step",
                "arguments": ["startTime", "stop_time"],
                "output": "tempOut"
            }
        ]
    }
}